{
  "$schema": "./capability-manifest.schema.json",
  "schemaVersion": "1.0.0",
  "capturedAt": "2026-08-11T20:30:00+07:00",
  "releaseTrain": {
    "id": "oc-2026.7.1-2-locked.1",
    "openclawVersion": "2026.7.1-2",
    "gitTag": "v2026.7.1-2",
    "gitCommit": "0790d9f593ad30c940ed93b5872a8cf6d6f3cf8c",
    "protocolVersion": 4
  },
  "sourcePolicy": {
    "documentedSourcesOnly": true,
    "helloOkIsCompleteInventory": false,
    "privateWorkspacePackagesImportable": false,
    "advertisingRequiresProductTest": true
  },
  "requiredFamilies": [
    "gateway",
    "providers-models",
    "sessions",
    "agents",
    "genesis",
    "advisor",
    "memory",
    "workspace-files",
    "tools-exec",
    "browser-web",
    "skills",
    "plugins",
    "mcp",
    "channels",
    "automation",
    "nodes",
    "media-voice",
    "usage-cost",
    "approvals-audit",
    "backup-restore",
    "updates",
    "diagnostics",
    "always-on"
  ],
  "capabilities": [
    {
      "id": "gateway.websocket-rpc",
      "family": "gateway",
      "name": "Gateway WebSocket RPC và handshake",
      "upstreamOwner": "openclaw",
      "integration": "gateway-rpc",
      "productMode": "hidden-infrastructure",
      "productTreatment": "WRAPPED",
      "evidenceLevel": "verified-upstream-smoke",
      "advertisable": false,
      "upstreamSources": [
        { "kind": "documentation", "path": "docs/gateway/external-apps.md", "surface": "WebSocket RPC for external apps", "evidence": "locked-document" },
        { "kind": "documentation", "path": "docs/gateway/protocol.md", "surface": "protocol v4, frames, roles and scopes", "evidence": "locked-document" },
        { "kind": "runtime-smoke", "path": "artifacts/feature-0.2/lab/gateway-contract-smoke.json", "surface": "Gateway startup and health RPC", "evidence": "verified-smoke" }
      ],
      "sourceOfTruthRefs": ["SOT-01", "SOT-07"],
      "trustBoundaryRefs": ["TB-01", "TB-02"],
      "scopes": ["operator.read"],
      "dataClasses": ["runtime-status", "protocol-metadata"],
      "conditions": ["Supervisor owns process, endpoint and bootstrap credential", "Renderer never receives Gateway token or port"],
      "blockers": ["AI for Boss Adapter and reconnect logic are not implemented"],
      "failureBehavior": "Do not report Ready until handshake, negotiated scopes, health and models.list pass; repeated failure enters Safe Mode.",
      "requiredGates": ["1.1", "1.2", "1.3"],
      "testIds": ["TEST-GATEWAY-HANDSHAKE", "TEST-GATEWAY-RECONNECT"]
    },
    {
      "id": "providers.catalog-auth",
      "family": "providers-models",
      "name": "Provider, model catalog và xác thực",
      "upstreamOwner": "openclaw",
      "integration": "gateway-rpc",
      "productMode": "both",
      "productTreatment": "BLOCKED",
      "evidenceLevel": "documented-upstream",
      "advertisable": false,
      "upstreamSources": [
        { "kind": "documentation", "path": "docs/providers/index.md", "surface": "provider catalog", "evidence": "locked-document" },
        { "kind": "documentation", "path": "docs/concepts/models.md", "surface": "model selection and fallback", "evidence": "locked-document" },
        { "kind": "documentation", "path": "docs/concepts/oauth.md", "surface": "OAuth profile behavior", "evidence": "locked-document" },
        { "kind": "documentation", "path": "docs/gateway/secrets.md", "surface": "SecretRef and OAuth separation", "evidence": "locked-document" }
      ],
      "sourceOfTruthRefs": ["SOT-01", "SOT-03", "SOT-04"],
      "trustBoundaryRefs": ["TB-02", "TB-03"],
      "scopes": ["operator.read", "operator.admin"],
      "dataClasses": ["provider-catalog", "model-metadata", "static-secret", "oauth-token"],
      "conditions": ["Auth mode must exist in auth-support manifest", "Live probe and revoke path required before production enablement"],
      "blockers": ["No dedicated live-auth test", "SecretRef broker lacks three-OS contract evidence"],
      "failureBehavior": "Keep connector disconnected; never downgrade auth mode, provider or model silently.",
      "requiredGates": ["0.5", "1.4", "3.7", "4"],
      "testIds": ["TEST-AUTH-LIVE-PROBE", "TEST-AUTH-REVOKE", "TEST-SECRETREF-3OS"]
    },
    {
      "id": "sessions.lifecycle-chat",
      "family": "sessions",
      "name": "Phiên, chat, history, attachment và artifact",
      "upstreamOwner": "openclaw",
      "integration": "gateway-rpc",
      "productMode": "both",
      "productTreatment": "WRAPPED",
      "evidenceLevel": "documented-upstream",
      "advertisable": false,
      "upstreamSources": [
        { "kind": "documentation", "path": "docs/concepts/session.md", "surface": "Gateway-owned session lifecycle and isolation", "evidence": "locked-document" },
        { "kind": "documentation", "path": "docs/gateway/external-apps.md", "surface": "sessions RPC and events", "evidence": "locked-document" }
      ],
      "sourceOfTruthRefs": ["SOT-01"],
      "trustBoundaryRefs": ["TB-01", "TB-02"],
      "scopes": ["operator.read", "operator.write"],
      "dataClasses": ["prompt", "transcript", "attachment", "artifact", "usage"],
      "conditions": ["OpenClaw remains authoritative", "UI cache must be rebuildable"],
      "blockers": ["Adapter session projection and reconnect are not implemented"],
      "failureBehavior": "Preserve the last confirmed state and mark in-flight work unknown until backfill reconciles it.",
      "requiredGates": ["1.2", "1.3", "2.3"],
      "testIds": ["TEST-SESSION-BACKFILL", "TEST-SESSION-IDEMPOTENCY"]
    },
    {
      "id": "agents.lifecycle-coordination",
      "family": "agents",
      "name": "Agent, sub-agent, task và phối hợp",
      "upstreamOwner": "shared",
      "integration": "product-orchestration",
      "productMode": "both",
      "productTreatment": "WRAPPED",
      "evidenceLevel": "documented-upstream",
      "advertisable": false,
      "upstreamSources": [
        { "kind": "documentation", "path": "docs/concepts/agent.md", "surface": "agent runtime", "evidence": "locked-document" },
        { "kind": "documentation", "path": "docs/concepts/multi-agent.md", "surface": "agent isolation and bindings", "evidence": "locked-document" },
        { "kind": "documentation", "path": "docs/tools/subagents.md", "surface": "sub-agent orchestration", "evidence": "locked-document" }
      ],
      "sourceOfTruthRefs": ["SOT-01", "SOT-02", "SOT-05"],
      "trustBoundaryRefs": ["TB-02", "TB-05", "TB-06"],
      "scopes": ["operator.read", "operator.write"],
      "dataClasses": ["agent-identity", "task", "goal", "delegated-output", "budget"],
      "conditions": ["Each Agent has separate Agent Home, agentDir, session and auth profile", "Delegated output remains untrusted input"],
      "blockers": ["Product orchestration and budget enforcement are not implemented"],
      "failureBehavior": "Stop delegation at the last confirmed checkpoint; do not merge unverified child output into a final result.",
      "requiredGates": ["2.5", "3.7"],
      "testIds": ["TEST-AGENT-ISOLATION", "TEST-MULTIAGENT-BUDGET"]
    },
    {
      "id": "genesis.bootstrap-identity",
      "family": "genesis",
      "name": "Khai sinh Agent và vòng đời danh tính",
      "upstreamOwner": "shared",
      "integration": "cli-contract",
      "productMode": "basic",
      "productTreatment": "WRAPPED",
      "evidenceLevel": "documented-upstream",
      "advertisable": false,
      "upstreamSources": [
        { "kind": "documentation", "path": "docs/start/bootstrapping.md", "surface": "first-run bootstrap ritual", "evidence": "locked-document" },
        { "kind": "documentation", "path": "docs/concepts/agent-workspace.md", "surface": "workspace file contract", "evidence": "locked-document" },
        { "kind": "cli", "path": "docs/cli/agents.md", "surface": "agents set-identity", "evidence": "locked-document" }
      ],
      "sourceOfTruthRefs": ["SOT-01", "SOT-05", "SOT-06"],
      "trustBoundaryRefs": ["TB-02", "TB-05"],
      "scopes": ["operator.admin"],
      "dataClasses": ["identity", "persona", "user-profile", "workspace-grant"],
      "conditions": ["Bootstrap contract manifest validates release-train templates", "BOOTSTRAP.md is removed only after readback, identity sync and health check"],
      "blockers": ["Transactional writer and crash-resume logic are not implemented"],
      "failureBehavior": "Keep BOOTSTRAP.md and transition to PENDING_RESUME; never report the Agent Active.",
      "requiredGates": ["2.2", "2.5"],
      "testIds": ["TEST-GENESIS-CRASH-RESUME", "TEST-GENESIS-AGENT-SEPARATION"]
    },
    {
      "id": "advisor.plan-final-review",
      "family": "advisor",
      "name": "Advisor phản biện kế hoạch và kiểm tra đầu cuối",
      "upstreamOwner": "ai-for-boss",
      "integration": "product-orchestration",
      "productMode": "basic",
      "productTreatment": "WRAPPED",
      "evidenceLevel": "planned-product-test",
      "advertisable": false,
      "upstreamSources": [
        { "kind": "documentation", "path": "docs/concepts/multi-agent.md", "surface": "isolated agent/session primitives", "evidence": "locked-document" },
        { "kind": "documentation", "path": "docs/gateway/operator-scopes.md", "surface": "least-privilege operator scopes", "evidence": "locked-document" }
      ],
      "sourceOfTruthRefs": ["SOT-01", "SOT-02"],
      "trustBoundaryRefs": ["TB-02", "TB-06"],
      "scopes": ["operator.read"],
      "dataClasses": ["goal", "draft-plan", "worker-output", "selected-evidence", "review-verdict"],
      "conditions": ["Separate review session", "No mutating tool, memory write, message send, exec or browser action", "Schema-validated verdict"],
      "blockers": ["Advisor orchestration, prompt-injection defense and benchmark are not implemented"],
      "failureBehavior": "Mark output unreviewed; never coerce parse failure, timeout or budget exhaustion into pass.",
      "requiredGates": ["2.6", "3.7"],